{
  "absolute_runtime_path_in_canonical_identity_count": 0,
  "accepted_daily_closures": 0,
  "accepted_weekend_closures": 149,
  "atr_events_generated": false,
  "authorization_identity_sha256": "b2fb6bfe4c96f8d18d910b78180ea7b70d3c9ba2ad4142c859e03be6559ea97d",
  "b3a_summary_sha256": "c31476f8e75b36231fa1c6b67b2e1d1a95668abe1a8311cc69d30e62e8d1eeab",
  "candidate": "NOT_READY_FOR_ORDER_LOGIC",
  "canonical_summary_sha256": "fd1c7570e7cba00ba77c20b406d041c92247a189836414c10933ed31783d0134",
  "checkpoint": "FR_PREP_B4",
  "dataset_id": "FP_FQ_2020_2022_GOLD_H1",
  "decision": "FR_PREP_B4_PASS_SEALED_FQ_EVENT_POPULATION_REPLAY",
  "event_count": 493,
  "fn_interpretation_performed": false,
  "gap_count": 774,
  "long_count": 252,
  "mismatch_counters": {
    "candidate_status_mismatch": 0,
    "event_count_mismatch": 0,
    "event_id_or_row_order_mismatch": 0,
    "hash_mismatch": 0,
    "negative_test_mismatch": 0,
    "normal_repeat_mismatch": 0,
    "relocation_mismatch": 0,
    "source_or_gap_mismatch": 0
  },
  "mt5_ea_executed": false,
  "negative_tests": {
    "all_passed": true,
    "passed": 4,
    "results": {
      "external_process_blocked": true,
      "prohibited_permission_blocked": true,
      "wrong_authorization_blocked": true,
      "wrong_validated_state_blocked": true
    },
    "total": 4
  },
  "order_logic": "NOT_APPROVED",
  "outcomes_generated": false,
  "output_hashes": {
    "candidate_status_sha256": "fc83e886b505d837263755fac0ab31c75754eef7fa433df86743a29cd7553610",
    "complete_output_sha256": "aa7380d0a9c232be6e6fbdea52afcc4b015fbe6e3b5847556f645a05cf84cf46",
    "event_population_sha256": "78262072f3f81f45a00a9da002edb3fe9ca8171550bc741804cbb42152b66d81",
    "population_summary_sha256": "742472143107468c802cb601c6a29253ed771c3e1efb60e0386c5295c53a2046",
    "terminal_status_summary_sha256": "fce8936f7f866096582700306f3a7734309498bc7e2cc9f01c8b58a522802ee1"
  },
  "performance": "NOT_EVALUATED",
  "profitability": "NOT_CLAIMED",
  "resolved_source_row_keys": true,
  "runtime_audit": {
    "external_process_audit": {
      "blocked_launch_count": 1,
      "successful_launch_count": 0
    },
    "function_execution_counts": {
      "atr_event_generation_count": 0,
      "authorized_replay_count": 3,
      "detector_execution_count": 3,
      "ea_execution_count": 0,
      "fn_interpretation_count": 0,
      "fq_validator_execution_count": 0,
      "legacy_fj_execution_count": 0,
      "mt5_execution_count": 0,
      "optimization_count": 0,
      "outcome_generation_count": 0,
      "tp_sl_calculation_count": 0
    },
    "module_import_counts": {
      "detector_import_count": 1,
      "fq_validator_import_count": 0,
      "legacy_fj_runner_import_count": 0,
      "mt5_ea_import_count": 0,
      "wrapper_import_count": 0
    }
  },
  "schema_version": "fr_prep_b4_fq_holdout_event_population_replay.v1",
  "short_count": 241,
  "source_rows": 17731,
  "tp_sl_calculated": false,
  "unique_event_ids": true,
  "unverified_gaps": 625,
  "valid_timestamp_ordering": true,
  "year_counts": {
    "2020": 149,
    "2021": 181,
    "2022": 163
  }
}
